{
  "$schema": "https://json-schema.org/draft/2020-12/schema",
  "$id": "edit_plan.json",
  "title": "EditPlan",
  "type": "object",
  "additionalProperties": false,
  "required": ["status"],
  "properties": {
    "status": { "enum": ["ok", "needs_clarification"] },
    "ops": { "type": "array", "items": { "$ref": "edit_op.json" }, "default": [] },
    "clarification": {
      "type": ["object", "null"],
      "default": null,
      "additionalProperties": false,
      "required": ["question"],
      "properties": {
        "question": { "type": "string" },
        "options": {
          "type": "array",
          "default": [],
          "items": {
            "type": "object",
            "additionalProperties": false,
            "required": ["id", "label"],
            "properties": { "id": { "type": "string" }, "label": { "type": "string" } }
          }
        }
      }
    },
    "rejected": {
      "type": "array",
      "default": [],
      "items": {
        "type": "object",
        "additionalProperties": false,
        "required": ["request", "reason"],
        "properties": {
          "request": { "type": "string" },
          "reason": { "type": "string" },
          "suggestion": { "type": ["string", "null"], "default": null }
        }
      }
    }
  }
}
